<?xml-stylesheet type="text/css" href="employees.css"?>
<employees xmlns:xsi="http://www.w3.org/2001/XMLSchema-instance" xsi:noNamespaceSchemaLocation="file:///D:/iti/XML/labs/lab3/New%20folder/employees.xsd">
	<employee>
		<name>Tahoun</name>
		<phones>
			<phone type="home">031123468</phone>
			<phone type="work">014569791</phone>
			<phone type="mobile">0125675974</phone>
		</phones>
		<addresses>
			<address>
				<street>moharam bek,</street>
				<buildingNumber>66,</buildingNumber>
				<Region>moharram bek,</Region>
				<city>Alexandria,</city>
				<country>Egypt.</country>
			</address>
			<address>
				<street>wabour elmaya,</street>
				<buildingNumber>7,</buildingNumber>
				<Region>sharq,</Region>
				<city>Alexandria,</city>
				<country>Egypt.</country>
			</address>
		</addresses>
		<email>tahoun@gmail.com</email>
	</employee>
	<employee>
		<name>Ali</name>
		<phones>
			<phone type="home">0349675421</phone>
			<phone type="work">01124369874</phone>
			<phone type="mobile">0105679511</phone>
		</phones>
		<addresses>
			<address>
				<street>abu bakr,</street>
				<buildingNumber>5,</buildingNumber>
				<Region>5th settelement,</Region>
				<city>New Cairo,</city>
				<country>Egypt.</country>
			</address>
		</addresses>
		<email>ali@gmail.com</email>
	</employee>
</employees>
